{
  "$schema": "./schemas/microsoft-skills.schema.json",
  "version": "1.0.0",
  "extractedFrom": "https://github.com/microsoft/GitHub-Copilot-for-Azure (path: plugin/skills/)",
  "extractedAt": "2026-04-28",
  "extractionSource": "phase1-aks-automatic-grounding.md Part 9.1 inventory; cross-validated against simulation transcripts",
  "loadConvention": {
    "tool": "core.read_skill",
    "callPattern": "core.read_skill('<skill-id>', version='<version>')",
    "citationFormat": "Per `<skill-id>` skill v<version>, [content reference]",
    "constraintSpecCitationFormat": "Per `<skill-id>` skill v<version>, constraint spec v<x.y.z> (AKS <date>)",
    "versionPolicy": "If skill has placeholder version (e.g. v0.0.0-placeholder), cite the placeholder; future Phase 3 work may resolve to commit SHA at load time."
  },
  "skills": [
    {
      "id": "azure-kubernetes",
      "version": "v0.0.0-placeholder",
      "path": "plugin/skills/azure-kubernetes/SKILL.md",
      "purpose": "Day-0 AKS cluster planning + creation; Automatic vs Standard SKU selection; networking, security, observability, upgrades, performance defaults",
      "loadWhen": [
        "intent:cluster_creation",
        "intent:cluster_design",
        "track:containerized_web",
        "track:agentic_app",
        "track:repo_uplift",
        "track:migration_to_aks_automatic",
        "agent:aks.architect first invocation per session",
        "agent:azure.architect when AKS is the target compute"
      ],
      "validatedBySims": [
        "sim-01",
        "sim-02",
        "sim-03",
        "sim-05",
        "sim-06",
        "sim-07",
        "sim-09",
        "sim-11",
        "sim-12",
        "sim-04"
      ],
      "provenance": "extracted"
    },
    {
      "id": "azure-kubernetes-automatic-readiness",
      "version": "v1.0.0",
      "path": "plugin/skills/azure-kubernetes/azure-kubernetes-automatic-readiness/SKILL.md",
      "references": {
        "constraintSpec": "references/constraint-spec-v1.yaml",
        "constraintSpecVersion": "v1.1.1 (AKS 2026-03-15)",
        "migrationGuide": "references/migration-guide-summary.md",
        "helmRenderingGuidance": "references/helm-rendering-guidance.md"
      },
      "purpose": "Assess existing cluster or local manifests for AKS Automatic compatibility; produces fix diffs; cluster-connected (MCP) and offline modes",
      "loadWhen": [
        "intent:migration_to_aks_automatic",
        "intent:readiness_check",
        "intent:repo_uplift with existing k8s manifests detected",
        "intent:repo_uplift with charts/ or kustomize/ detected",
        "agent:aks.reviewer in readiness mode (D7)"
      ],
      "validatedBySims": [
        "sim-02",
        "sim-07"
      ],
      "provenance": "extracted"
    },
    {
      "id": "azure-cloud-migrate",
      "version": "v1.0.0",
      "path": "plugin/skills/azure-cloud-migrate/SKILL.md",
      "references": {
        "paasEquivalents": "references/paas-equivalents.md",
        "cutoverRunbook": "references/cutover-runbook.md"
      },
      "purpose": "Cloud-to-cloud migration playbook (Render/Heroku/Vercel/Fly/AWS/GCP/on-prem \u2192 Azure)",
      "loadWhen": [
        "intent:paas_migration",
        "intent:cloud_migration",
        "source:render OR source:heroku OR source:vercel OR source:fly OR source:netlify OR source:railway OR source:aws OR source:gcp",
        "agent:azure.architect when source PaaS is mentioned"
      ],
      "validatedBySims": [
        "sim-10",
        "sim-11"
      ],
      "provenance": "extracted"
    },
    {
      "id": "azure-prepare",
      "version": "v0.0.0-placeholder",
      "path": "plugin/skills/azure-prepare/SKILL.md",
      "purpose": "Subscription / resource-group / quota / RBAC preflight checks",
      "loadWhen": [
        "intent:any_provisioning_intent before generation",
        "agent:azure.architect first invocation per subscription",
        "agent:aks.architect first invocation per subscription"
      ],
      "validatedBySims": [],
      "provenance": "extracted"
    },
    {
      "id": "azure-validate",
      "version": "v0.0.0-placeholder",
      "path": "plugin/skills/azure-validate/SKILL.md",
      "purpose": "Post-deploy readiness checks against the deployed cluster",
      "loadWhen": [
        "intent:post_deploy_validation",
        "agent:aks.reviewer in cluster-connected mode",
        "post-cutover sims (Sim #2 Phase 3 server-side dry-run)"
      ],
      "validatedBySims": [
        "sim-02 (referenced in Phase 3 playbook)"
      ],
      "provenance": "extracted"
    },
    {
      "id": "azure-deploy",
      "version": "v0.0.0-placeholder",
      "path": "plugin/skills/azure-deploy/SKILL.md",
      "purpose": "Deployment orchestration (Bicep deploy, ARM deploy)",
      "loadWhen": [
        "agent:azure.ops",
        "intent:deploy when GHA workflow is not the orchestration path"
      ],
      "validatedBySims": [],
      "provenance": "extracted"
    },
    {
      "id": "azure-diagnostics",
      "version": "v0.0.0-placeholder",
      "path": "plugin/skills/azure-diagnostics/SKILL.md",
      "purpose": "Live troubleshooting (pod crashes, deploy failures, cluster issues)",
      "loadWhen": [
        "intent:troubleshoot",
        "intent:my_deployment_isnt_working",
        "iteration mode + user reports failure"
      ],
      "validatedBySims": [],
      "provenance": "extracted"
    },
    {
      "id": "azure-cost",
      "version": "v1.1.0",
      "path": "plugin/skills/azure-cost/SKILL.md",
      "purpose": "Cost analysis: SKU selection, upgrade triggers, multi-tier comparison",
      "loadWhen": [
        "agent:azure.architect when generating R16 cost card",
        "intent:cost_optimization",
        "intent:reduce_cost",
        "user objects to cost (cost-shock branch in triage)"
      ],
      "validatedBySims": [
        "sim-11"
      ],
      "provenance": "extracted"
    },
    {
      "id": "azure-quotas",
      "version": "v0.0.0-placeholder",
      "path": "plugin/skills/azure-quotas/SKILL.md",
      "purpose": "Quota discovery + request links",
      "loadWhen": [
        "intent:any_plan_with_GPU_SKUs",
        "intent:any_plan_with_unusual_VM_families",
        "agent:aks.architect on agentic_app + kaito track (D13)",
        "fallback when azure.quota_lookup tool not yet available"
      ],
      "validatedBySims": [
        "sim-03"
      ],
      "provenance": "extracted"
    },
    {
      "id": "azure-rbac",
      "version": "v0.0.0-placeholder",
      "path": "plugin/skills/azure-rbac/SKILL.md",
      "purpose": "RBAC role discovery + assignment patterns",
      "loadWhen": [
        "agent:aks.architect when generating Workload Identity wiring (role assignments)",
        "intent:any_plan_that_grants_role"
      ],
      "validatedBySims": [
        "sim-04"
      ],
      "provenance": "extracted"
    },
    {
      "id": "azure-resource-lookup",
      "version": "v0.0.0-placeholder",
      "path": "plugin/skills/azure-resource-lookup/SKILL.md",
      "purpose": "Find existing resources by name / type",
      "loadWhen": [
        "intent:check_for_existing_<resource>",
        "agent:any when user mentions 'existing ACR', 'existing VNet', 'existing Key Vault'",
        "iteration mode prerequisite check (Sim #9)"
      ],
      "validatedBySims": [
        "sim-09 (used arm_get directly with this skill's pattern)",
        "sim-04 (used arm_get on cluster + Foundry)"
      ],
      "provenance": "extracted"
    },
    {
      "id": "azure-resource-visualizer",
      "version": "v0.0.0-placeholder",
      "path": "plugin/skills/azure-resource-visualizer/SKILL.md",
      "purpose": "Generate architecture diagrams from live resources",
      "loadWhen": [
        "intent:visualize_existing_deployment",
        "post-deploy diagram generation",
        "could replace aks.build_architecture_diagram for post-deploy state"
      ],
      "validatedBySims": [],
      "provenance": "extracted"
    },
    {
      "id": "azure-storage",
      "version": "v0.0.0-placeholder",
      "path": "plugin/skills/azure-storage/SKILL.md",
      "purpose": "Azure Storage / disk / files / blob / container storage; ACStor v2 patterns",
      "loadWhen": [
        "intent:any_KAITO_scenario_needing_ACStor_v2",
        "intent:LLM_workload_storage_design",
        "agent:aks.architect when KAITO preset+adapter mode"
      ],
      "validatedBySims": [
        "sim-03"
      ],
      "provenance": "extracted"
    },
    {
      "id": "azure-upgrade",
      "version": "v0.0.0-placeholder",
      "path": "plugin/skills/azure-upgrade/SKILL.md",
      "purpose": "AKS upgrade orchestration",
      "loadWhen": [
        "intent:cluster_upgrade",
        "iteration scenarios for existing clusters",
        "Phase 4 of migration playbook"
      ],
      "validatedBySims": [],
      "provenance": "extracted"
    },
    {
      "id": "azure-compliance",
      "version": "v0.0.0-placeholder",
      "path": "plugin/skills/azure-compliance/SKILL.md",
      "purpose": "Azure Policy / regulatory compliance / Service Trust Portal patterns",
      "loadWhen": [
        "intent:compliance_check",
        "user states compliance/residency reason (GDPR, EU residency, SOC 2, ISO 27001, HIPAA)",
        "agent:azure.architect when complianceMode: true"
      ],
      "validatedBySims": [
        "sim-10",
        "sim-04"
      ],
      "provenance": "extracted"
    },
    {
      "id": "azure-enterprise-infra-planner",
      "version": "v0.0.0-placeholder",
      "path": "plugin/skills/azure-enterprise-infra-planner/SKILL.md",
      "purpose": "Multi-resource enterprise infra planning; platform team review handoff",
      "loadWhen": [
        "intent:enterprise_infra_planning",
        "user mentions 'platform team', 'GitOps repo', 'IaC monorepo'",
        "agent:azure.architect for Erin-shaped scenarios (sim #4)"
      ],
      "validatedBySims": [],